id,business_name,description,category
1,TechCorp Solutions,Innovative IT solutions provider specializing in cloud services and AI.,Technology
2,GreenLeaf Eco,Sustainable products promoting an eco-friendly lifestyle.,Eco Products
3,UrbanStyle Fashions,Trendy and affordable clothing for urban youth.,Retail
4,DigitalDynamics,Cutting-edge digital marketing and e-commerce services.,Technology
5,HealthyHarvest Foods,Organic and non-GMO foods for a healthier lifestyle.,Food & Beverage
6,BrightFuture Education,Education resources and e-learning platforms for all ages.,Education
7,HomeHaven Decor,Modern and stylish home decor for urban homes.,Home & Living
8,EliteFitness Center,State-of-the-art fitness equipment and personal training services.,Fitness
9,AutoPro Mechanics,Comprehensive automotive repair and maintenance services.,Automotive
10,SecureVault Systems,Advanced cybersecurity solutions for businesses of all sizes.,Technology
11,SkyHigh Travel,Luxury travel packages and personalized trip planning.,Travel
12,PureBeauty Spa,Holistic spa treatments for beauty and relaxation.,Health & Wellness
13,QuickBite Deli,Quick and delicious deli meals for busy professionals.,Food & Beverage
14,PeakPerformance Consulting,Expert consulting services to optimize business performance.,Consulting
15,EcoFriendly Supplies,Eco-friendly office and household supplies.,Eco Products
16,DreamBuilders Construction,Custom home construction with a focus on sustainability.,Construction
17,Innovate Marketing,Creative marketing strategies for startups and small businesses.,Marketing
18,Guardian Insurance,Reliable and affordable insurance plans for families and businesses.,Insurance
19,SmartLiving Electronics,Smart home gadgets and electronics for modern living.,Electronics
20,FreshBloom Florists,Beautiful floral arrangements for all occasions.,Retail
